{
  "delta_id": "ldd-post-close-defense-reconciliation-20260609-0828-sgt",
  "project": "tianma-work-os",
  "subproject": "llm-daredevil-desk",
  "sync_time": "2026-06-09T08:28:00+08:00",
  "source_cutoff_time": "2026-06-09 08:26-08:28 SGT/BJT",
  "source_of_truth": [
    "user_provided_longbridge_comprehensive_account_us_holdings_hk_holdings_and_after_hours_watchlist_screenshots",
    "user_provided_binance_spot_overview_and_coin_list_screenshots",
    "external_market_cross_check_used_only_for_context"
  ],
  "updates_or_supersedes": [
    "records/ldd/2026-06-08/ldd_core_position_defense_checkpoint_0843_0844_sgt.json",
    "pending_instruction:2026-06-08 17:04-17:05 SGT/BJT premarket-only delta"
  ],
  "included_events": [
    "2026-06-08 U.S. regular-session post-close account state",
    "GLD premarket trigger to post-close outcome reconciliation",
    "no visible execution and broker same-day order count 0/0",
    "NVDA, GOOG/GGLL, GLD, BTC, and crypto defense rule updates",
    "closed-position opportunity-cost separation",
    "HK high-profit protection requirement",
    "quote type tagging reinforcement"
  ],
  "pending_events": [
    "Confirm whether GLD reclaims 400-405 or loses 395/392.",
    "Confirm whether NVDA reclaims 210-212 or breaks 204/200.",
    "Confirm whether GOOG reaches 365-370 or breaks 355.",
    "Recognize new execution only from broker or Binance order evidence."
  ],
  "delta_reason": "The post-close review supersedes the earlier premarket-only instruction because it contains both the updated account state and the observed outcome of the GLD premarket risk trigger.",
  "changed_fields": [
    "latest_active_checkpoint",
    "broker_and_binance_account_state",
    "gld_active_risk_non_execution_outcome",
    "nvda_core_risk_thresholds",
    "goog_ggll_risk_valve_state",
    "quote_type",
    "pending_instruction_freshness"
  ],
  "new_records": [
    "records/ldd/2026-06-09/account_state_delta_0826_0828_sgt.json",
    "records/ldd/2026-06-09/premarket_trigger_to_post_close_outcome_reconciliation_0826_0828_sgt.json",
    "records/ldd/2026-06-09/active_risk_non_execution_review_0826_0828_sgt.json",
    "records/ldd/2026-06-09/gld_active_risk_rule_update_0826_0828_sgt.json",
    "records/ldd/2026-06-09/nvda_core_risk_trigger_update_0826_0828_sgt.json",
    "records/ldd/2026-06-09/goog_ggll_risk_valve_update_0826_0828_sgt.json",
    "records/ldd/2026-06-09/closed_position_opportunity_cost_requirement_0826_0828_sgt.json",
    "records/ldd/2026-06-09/hk_high_profit_protection_requirement_0826_0828_sgt.json",
    "records/ldd/2026-06-09/quote_type_tagging_reinforcement_0826_0828_sgt.json",
    "records/ldd/2026-06-09/crypto_defense_state_delta_0826_0828_sgt.json",
    "records/ldd/2026-06-09/pending_instruction_supersession_0826_0828_sgt.json"
  ],
  "related_records": [
    "records/ldd/2026-06-08/account_state_delta_0843_0844_sgt.json",
    "records/ldd/2026-06-08/remaining_leveraged_risk_monitor_0843_0844_sgt.json"
  ],
  "sync_status": "delta_update"
}
