{
  "delta_id": "ldd-post-close-execution-review-20260610-0849-sgt",
  "project": "tianma-work-os",
  "subproject": "llm-daredevil-desk",
  "sync_time": "2026-06-10T08:49:00+08:00",
  "source_cutoff_time": "2026-06-10 08:48-08:49 SGT/BJT",
  "source_of_truth": [
    "user_provided_longbridge_total_account_holdings_orders_and_after_hours_screenshots_20260610_0848_0849_sgt",
    "user_provided_binance_spot_overview_and_coin_list_screenshots_20260610_0848_0849_sgt"
  ],
  "updates_or_supersedes": [
    "records/ldd/2026-06-09/ldd_post_close_review_0826_0828_sgt.json",
    "uncommitted_or_pending_2026-06-09_1726_1727_premarket_only_phase5_9_instruction"
  ],
  "included_events": [
    "GLD sell 5 at displayed price 390.91 filled",
    "GLD sell 5 at displayed price 391.05 filled",
    "NVDA sell 5 at displayed price 201.74 filled",
    "GLD position reduced from 20 to 10",
    "NVDA position reduced from 20 to 15",
    "U.S. cash increased to approximately 11220.14 USD",
    "Runtime status conflict arbitrated in favor of actual Phase 5.8 baseline"
  ],
  "pending_events": [
    "No visible pending orders after the confirmed fills",
    "No visible cancelled orders after the confirmed fills",
    "No new U.S. or crypto buying",
    "No latest running ZEC bot screenshot"
  ],
  "delta_reason": "The post-close source includes confirmed order records and post-sale holdings, making it more authoritative than the superseded premarket-only instruction.",
  "changed_fields": [
    "latest_active_checkpoint",
    "confirmed_execution_writeback",
    "GLD quantity 20 to 10",
    "NVDA quantity 20 to 15",
    "U.S. cash ratio approximately 45.8 percent",
    "GLD rule status",
    "NVDA rule status",
    "HK high-profit protection escalation",
    "runtime status arbitration"
  ],
  "new_records": [
    "records/ldd/2026-06-10/account_state_delta_0848_0849_sgt.json",
    "records/ldd/2026-06-10/executed_order_writeback_0848_0849_sgt.json",
    "records/ldd/2026-06-10/rule_compliance_vs_price_outcome_review_0848_0849_sgt.json",
    "records/ldd/2026-06-10/rule_trigger_monitor_0848_0849_sgt.json",
    "records/ldd/2026-06-10/runtime_status_conflict_arbitration_0848_0849_sgt.json"
  ],
  "related_records": [
    "records/ldd/2026-06-09/account_state_delta_0826_0828_sgt.json",
    "records/ldd/2026-06-09/active_risk_non_execution_review_0826_0828_sgt.json"
  ],
  "sync_status": "execution_confirmed_and_checkpoint_updated"
}
